{"iteration": 1, "timestamp": "2026-03-10T16:03:26.896377+00:00", "param": "long_exit_prob_max", "from": 0.48, "to": 0.45, "space_before": [0.4, 0.6], "space_after": [0.4, 0.54], "suggestion": "keep", "status": "keep", "score": -27.110319, "param_weight": 1.2, "description": "long_exit_prob_max: 0.48 -> 0.45"}
{"iteration": 2, "timestamp": "2026-03-10T16:03:36.300795+00:00", "param": "short_exit_prob_min", "from": 0.52, "to": 0.5, "space_before": [0.4, 0.65], "space_after": [0.4, 0.64], "suggestion": "discard", "status": "discard", "score": -27.470952, "param_weight": 0.9, "description": "short_exit_prob_min: 0.52 -> 0.5"}
{"iteration": 3, "timestamp": "2026-03-10T16:03:45.405969+00:00", "param": "short_entry_ret", "from": -0.004, "to": -0.001, "space_before": [-0.02, -0.001], "space_after": [-0.014, -0.001], "suggestion": "discard", "status": "discard", "score": -29.468207, "param_weight": 0.9, "description": "short_entry_ret: -0.004 -> -0.001"}
{"iteration": 4, "timestamp": "2026-03-10T16:03:54.254403+00:00", "param": "long_entry_ret", "from": 0.004, "to": 0.007, "space_before": [0.001, 0.02], "space_after": [0.001, 0.015], "suggestion": "keep", "status": "keep", "score": -25.719822, "param_weight": 1.2, "description": "long_entry_ret: 0.004 -> 0.007"}
{"iteration": 5, "timestamp": "2026-03-10T16:04:02.716471+00:00", "param": "stoploss", "from": -0.02, "to": -0.023, "space_before": [-0.06, -0.005], "space_after": [-0.046, -0.005], "suggestion": "keep", "status": "keep", "score": -25.719822, "param_weight": 1.2, "description": "stoploss: -0.02 -> -0.023"}
{"iteration": 6, "timestamp": "2026-03-10T16:04:11.301532+00:00", "param": "long_exit_prob_max", "from": 0.45, "to": 0.42, "space_before": [0.4, 0.54], "space_after": [0.4, 0.48], "suggestion": "keep", "status": "keep", "score": -25.077071, "param_weight": 1.44, "description": "long_exit_prob_max: 0.45 -> 0.42"}
{"iteration": 7, "timestamp": "2026-03-10T16:04:20.016181+00:00", "param": "long_entry_ret", "from": 0.007, "to": 0.005, "space_before": [0.001, 0.015], "space_after": [0.001, 0.015], "suggestion": "discard", "status": "discard", "score": -25.536039, "param_weight": 1.08, "description": "long_entry_ret: 0.007 -> 0.005"}
{"iteration": 8, "timestamp": "2026-03-10T16:04:28.798298+00:00", "param": "short_entry_ret", "from": -0.004, "to": -0.002, "space_before": [-0.014, -0.001], "space_after": [-0.011, -0.001], "suggestion": "discard", "status": "discard", "score": -27.23559, "param_weight": 0.81, "description": "short_entry_ret: -0.004 -> -0.002"}
{"iteration": 9, "timestamp": "2026-03-10T16:04:38.033814+00:00", "param": "long_entry_ret", "from": 0.007, "to": 0.005, "space_before": [0.001, 0.015], "space_after": [0.001, 0.015], "suggestion": "discard", "status": "discard", "score": -25.536039, "param_weight": 0.9720000000000001, "description": "long_entry_ret: 0.007 -> 0.005"}
{"iteration": 10, "timestamp": "2026-03-10T16:04:47.770772+00:00", "param": "short_exit_prob_min", "from": 0.52, "to": 0.55, "space_before": [0.4, 0.64], "space_after": [0.4, 0.64], "suggestion": "discard", "status": "discard", "score": -25.092547, "param_weight": 0.81, "description": "short_exit_prob_min: 0.52 -> 0.55"}
{"iteration": 11, "timestamp": "2026-03-10T16:04:56.757947+00:00", "param": "long_exit_prob_max", "from": 0.42, "to": 0.4, "space_before": [0.4, 0.48], "space_after": [0.4, 0.43], "suggestion": "keep", "status": "keep", "score": -24.909076, "param_weight": 1.728, "description": "long_exit_prob_max: 0.42 -> 0.4"}
{"iteration": 12, "timestamp": "2026-03-10T16:05:05.801549+00:00", "param": "short_prob_max", "from": 0.45, "to": 0.44, "space_before": [0.25, 0.5], "space_after": [0.33, 0.5], "suggestion": "keep", "status": "keep", "score": -24.652241, "param_weight": 1.2, "description": "short_prob_max: 0.45 -> 0.44"}
{"iteration": 13, "timestamp": "2026-03-10T16:05:14.473929+00:00", "param": "short_exit_prob_min", "from": 0.52, "to": 0.49, "space_before": [0.4, 0.64], "space_after": [0.4, 0.64], "suggestion": "discard", "status": "discard", "score": -25.13453, "param_weight": 0.7290000000000001, "description": "short_exit_prob_min: 0.52 -> 0.49"}
{"iteration": 14, "timestamp": "2026-03-10T16:05:23.321152+00:00", "param": "short_exit_prob_min", "from": 0.52, "to": 0.5, "space_before": [0.4, 0.64], "space_after": [0.4, 0.64], "suggestion": "discard", "status": "discard", "score": -25.010809, "param_weight": 0.6561000000000001, "description": "short_exit_prob_min: 0.52 -> 0.5"}
{"iteration": 15, "timestamp": "2026-03-10T16:05:31.929676+00:00", "param": "long_exit_prob_max", "from": 0.4, "to": 0.42, "space_before": [0.4, 0.43], "space_after": [0.4, 0.43], "suggestion": "discard", "status": "discard", "score": -24.652241, "param_weight": 1.5552, "description": "long_exit_prob_max: 0.4 -> 0.42"}
{"iteration": 16, "timestamp": "2026-03-10T16:05:41.539166+00:00", "param": "short_entry_ret", "from": -0.004, "to": -0.005, "space_before": [-0.011, -0.001], "space_after": [-0.009, -0.001], "suggestion": "keep", "status": "keep", "score": -23.473942, "param_weight": 0.972, "description": "short_entry_ret: -0.004 -> -0.005"}
{"iteration": 17, "timestamp": "2026-03-10T16:05:51.103728+00:00", "param": "long_entry_ret", "from": 0.007, "to": 0.008, "space_before": [0.001, 0.015], "space_after": [0.002, 0.014], "suggestion": "keep", "status": "keep", "score": -22.261429, "param_weight": 1.1664, "description": "long_entry_ret: 0.007 -> 0.008"}
{"iteration": 18, "timestamp": "2026-03-10T16:06:00.492414+00:00", "param": "long_entry_ret", "from": 0.008, "to": 0.007, "space_before": [0.002, 0.014], "space_after": [0.001, 0.015], "suggestion": "discard", "status": "discard", "score": -23.473942, "param_weight": 1.04976, "description": "long_entry_ret: 0.008 -> 0.007"}
{"iteration": 19, "timestamp": "2026-03-10T16:06:09.192192+00:00", "param": "long_exit_prob_max", "from": 0.4, "to": 0.43, "space_before": [0.4, 0.43], "space_after": [0.4, 0.43], "suggestion": "discard", "status": "discard", "score": -22.261429, "param_weight": 1.39968, "description": "long_exit_prob_max: 0.4 -> 0.43"}
{"iteration": 20, "timestamp": "2026-03-10T16:06:17.804025+00:00", "param": "short_prob_max", "from": 0.44, "to": 0.45, "space_before": [0.33, 0.5], "space_after": [0.35, 0.5], "suggestion": "discard", "status": "discard", "score": -22.532863, "param_weight": 1.08, "description": "short_prob_max: 0.44 -> 0.45"}
{"iteration": 21, "timestamp": "2026-03-10T16:06:26.433815+00:00", "param": "long_entry_ret", "from": 0.008, "to": 0.007, "space_before": [0.001, 0.015], "space_after": [0.001, 0.016], "suggestion": "discard", "status": "discard", "score": -23.473942, "param_weight": 0.9447840000000001, "description": "long_entry_ret: 0.008 -> 0.007"}
{"iteration": 22, "timestamp": "2026-03-10T16:06:35.766885+00:00", "param": "short_exit_prob_min", "from": 0.52, "to": 0.54, "space_before": [0.4, 0.64], "space_after": [0.44, 0.64], "suggestion": "keep", "status": "keep", "score": -21.945608, "param_weight": 0.7873200000000001, "description": "short_exit_prob_min: 0.52 -> 0.54"}
{"iteration": 23, "timestamp": "2026-03-10T16:06:44.736307+00:00", "param": "stoploss", "from": -0.02, "to": -0.021, "space_before": [-0.046, -0.005], "space_after": [-0.038, -0.005], "suggestion": "keep", "status": "keep", "score": -21.945608, "param_weight": 1.44, "description": "stoploss: -0.02 -> -0.021"}
{"iteration": 24, "timestamp": "2026-03-10T16:06:53.459983+00:00", "param": "long_exit_prob_max", "from": 0.4, "to": 0.43, "space_before": [0.4, 0.43], "space_after": [0.4, 0.46], "suggestion": "keep", "status": "keep", "score": -21.945608, "param_weight": 1.679616, "description": "long_exit_prob_max: 0.4 -> 0.43"}
{"iteration": 25, "timestamp": "2026-03-10T16:07:02.714420+00:00", "param": "long_entry_ret", "from": 0.008, "to": 0.011, "space_before": [0.001, 0.016], "space_after": [0.005, 0.017], "suggestion": "keep", "status": "keep", "score": -20.155263, "param_weight": 1.1337408, "description": "long_entry_ret: 0.008 -> 0.011"}
{"iteration": 26, "timestamp": "2026-03-10T16:07:10.984521+00:00", "param": "short_entry_ret", "from": -0.005, "to": -0.006, "space_before": [-0.009, -0.001], "space_after": [-0.009, -0.001], "suggestion": "discard", "status": "discard", "score": -20.282807, "param_weight": 0.8748, "description": "short_entry_ret: -0.005 -> -0.006"}
{"iteration": 27, "timestamp": "2026-03-10T16:07:19.151677+00:00", "param": "stoploss", "from": -0.02, "to": -0.022, "space_before": [-0.038, -0.005], "space_after": [-0.036, -0.008], "suggestion": "keep", "status": "keep", "score": -20.155263, "param_weight": 1.728, "description": "stoploss: -0.02 -> -0.022"}
{"iteration": 28, "timestamp": "2026-03-10T16:07:27.426023+00:00", "param": "stoploss", "from": -0.02, "to": -0.019, "space_before": [-0.036, -0.008], "space_after": [-0.031, -0.007], "suggestion": "keep", "status": "keep", "score": -20.155263, "param_weight": 2.0736, "description": "stoploss: -0.02 -> -0.019"}
{"iteration": 29, "timestamp": "2026-03-10T16:07:35.585144+00:00", "param": "long_prob_min", "from": 0.55, "to": 0.58, "space_before": [0.5, 0.75], "space_after": [0.5, 0.69], "suggestion": "keep", "status": "keep", "score": -19.897648, "param_weight": 1.2, "description": "long_prob_min: 0.55 -> 0.58"}
{"iteration": 30, "timestamp": "2026-03-10T16:07:44.011273+00:00", "param": "stoploss", "from": -0.02, "to": -0.022, "space_before": [-0.031, -0.007], "space_after": [-0.033, -0.007], "suggestion": "discard", "status": "discard", "score": -19.897648, "param_weight": 1.86624, "description": "stoploss: -0.02 -> -0.022"}
